url,name,address,city,state,phone
https://www.kernuttstokes.com/about-us/eugene-office/,Kernutt Stokes - Eugene Certified Public Accountants & Consultants,"1600 Executive Pkwy #110, Eugene, OR 97401",Eugene,OR,(541) 687-1170
http://www.tomjonescpa.com/,Thomas C. Jones CPA,"105 South St, Elkton, MD 21921",Elkton,MD,(410) 398-9382
https://www.kernuttstokes.com/about-us/corvallis-office/,Kernutt Stokes - Corvallis Certified Public Accountants & Consultants,"2273 NW Professional Dr #200, Corvallis, OR 97330",Corvallis,OR,(541) 752-4556
https://www.facebook.com/ColtonAccountancy/,Kristin Colton CPA Accountancy PC,"1950 Church St Suite A, Baker City, OR 97814",Baker City,OR,(541) 523-9716
https://www.cbcpa.com/,Buchholz Charles E CPA,"79 Centennial Loop, Eugene, OR 97401",Eugene,OR,(541) 485-6500
