url,name,address,city,state,phone
http://www.lagrandecpa.com/,"Lewis, Poe, Moeller, Gunderson & Roberts, LLC","ÓÉą1121 Adams Ave, La Grande, OR 97850",La Grande,OR,Óāį(541) 963-4191
https://silvercreekteam.com/,Silver Creek Financial Services Inc.,"ÓÉą175 OR-82, Lostine, OR 97857",Lostine,OR,Óāį(541) 569-2272
https://sawtoothtax.com/,Sawtooth Tax and Accounting,"ÓÉą214 W Main St, Enterprise, OR 97828",Enterprise,OR,Óāį(541) 426-2299
http://www.cpaspot.com/,Spike Joseph CPA,"ÓÉą376 Q St, Springfield, OR 97477",Springfield,OR,Óāį(541) 741-2141
http://lagrandecpa.com/,"Connected Professional Accountants, LLC","ÓÉą1121 Adams Ave, La Grande, OR 97850",La Grande,OR,Óāį(541) 963-4191
https://wallowacountyland.com/,Real Estate Associates,"ÓÉą103 N Main St, Joseph, OR 97846",Joseph,OR,Óāį(541) 432-4060
https://www.solutionscpas.com/,"Solutions, CPA‚Äôs","ÓÉą101 NE 1st Ave, John Day, OR 97845",John Day,OR,Óāį(541) 575-2717
https://cptax.pro/,Results,"ÓÉą547 NE Bellevue Dr #108, Bend, OR 97701",Bend,OR,Óāį(541) 318-7001
http://www.jrwenterprise.com/,Results,"ÓÉą665 W Wharton St, Roseburg, OR 97471",Roseburg,OR,Óāį(541) 464-6082
https://www.bernardsandorourke.com/,Results,"ÓÉą12350 NW Main St #102, Banks, OR 97106",Banks,OR,Óāį(503) 324-6274
https://www.patrickandcasey.com/,Results,"ÓÉą2796 NW Clearwater Dr, Bend, OR 97703",Bend,OR,Óāį(541) 322-2142
https://capstoneaccounting.com/locations/lakeview?utm_source=google&utm_medium=organic&utm_campaign=gbp&utm_content=lakeview,Results,"ÓÉą411 Center St, Lakeview, OR 97630",Lakeview,OR,Óāį(541) 947-5006
http://www.hurlimancpa.com/,Results,"ÓÉą51915 Columbia River Hwy, Scappoose, OR 97056",Scappoose,OR,Óāį(503) 987-1587
https://aboveallaccounting.com/,Results,"ÓÉą1709 NE 27th St F, McMinnville, OR 97128",McMinnville,OR,Óāį(503) 648-6184
http://www.mthoodtax.com/,Results,"ÓÉą200 NW Division St, Gresham, OR 97030",Gresham,OR,Óāį(503) 667-1610
http://www.cpaservice.com/,Results,"ÓÉą4470 SW Hall Blvd, Beaverton, OR 97005",Beaverton,OR,Óāį(503) 747-4560
http://grangeracct.com/,Results,"ÓÉą10558 OR-62 ste b, Eagle Point, OR 97524",Eagle Point,OR,Óāį(541) 665-7005
http://www.marxenandhall.com/,Results,"ÓÉą315 S Main Ave, Warrenton, OR 97146",Warrenton,OR,Óāį(503) 861-3383
http://www.hkaplancpa.com/,Results,,Joseph,OR,Óāį(503) 739-4029
https://www.bobkellercpa.com/,Results,"ÓÉą6125 NE Cornell Rd #220, Hillsboro, OR 97124",Hillsboro,OR,Óāį(503) 648-6697
http://www.musserolsen.com/,Results,"ÓÉą561 5th St, Brookings, OR 97415",Brookings,OR,Óāį(541) 469-7448
https://www.co.wallowa.or.us/wallowa-county-museum,Results,"ÓÉą110 S Main St, Joseph, OR 97846",Joseph,OR,Óāį(541) 432-6095
